vs_link,vs_name,vs_id,ftm_name,ftm_idNV;https://justfacts.votesmart.org/interest-group/1070/nevada-republican-liberty-caucus,nevada republican liberty caucus,1070,Nevada Republican Liberty Caucus,9731758
NV;https://justfacts.votesmart.org/interest-group/2036/reno-sparks-chamber-of-commerce,reno sparks chamber of commerce,2036,Greater Reno-Sparks Chamber Of Commerce,9688965
NV;https://justfacts.votesmart.org/interest-group/2036/reno-sparks-chamber-of-commerce,reno sparks chamber of commerce,2036,Reno & Sparks Chamber Of Commerce,48047344
NV;https://justfacts.votesmart.org/interest-group/2036/reno-sparks-chamber-of-commerce,reno sparks chamber of commerce,2036,Reno + Sparks Chamber Of Commerce,54465071
NV;https://justfacts.votesmart.org/interest-group/2036/reno-sparks-chamber-of-commerce,reno sparks chamber of commerce,2036,Reno Sparks Chamber Of Commerce-The Chamber,48842981
NV;https://justfacts.votesmart.org/interest-group/2813/professional-fire-fighters-of-nevada,professional fire fighters of nevada,2813,Professional Fire Fighters Of Nevada,19522
NV;https://justfacts.votesmart.org/interest-group/3209/one-apia-nevada-pac,one apia nevada pac,3209,One Apia Nevada Pac,47283298
MT;https://justfacts.votesmart.org/interest-group/648/national-rifle-association-political-victory-fund,national rifle association political victory fund,648,TimeoutException,TimeoutException
NE;https://justfacts.votesmart.org/interest-group/2250/nebraska-firearms-owners-association-political-action-fund,nebraska firearms owners association political action fund,2250,TimeoutException,TimeoutException
NV;https://justfacts.votesmart.org/interest-group/460/nevada-state-education-association,nevada state education association,460,Nevada State Education Association Separate Segregated Funds,44129136
NE;https://justfacts.votesmart.org/interest-group/563/planned-parenthood-voters-of-nebraska,planned parenthood voters of nebraska,563,TimeoutException,TimeoutException
NV;https://justfacts.votesmart.org/interest-group/2252/nevada-state-afl-cio,nevada state afl cio,2252,Nevada State Afl-Cio,20154
NV;https://justfacts.votesmart.org/interest-group/2016/grassroots-nevada,grassroots nevada,2016,Grassroots Nevada Llc,39005496
NV;https://justfacts.votesmart.org/interest-group/2076/citizen-outreach,citizen outreach,2076,Citizen Outreach,27700470
NE;https://justfacts.votesmart.org/interest-group/350/nebraska-taxpayers-for-freedom,nebraska taxpayers for freedom,350,TimeoutException,TimeoutException
NV;https://justfacts.votesmart.org/interest-group/2726/service-employees-international-union-seiu-nevada,service employees international union seiu nevada,2726,TimeoutException,TimeoutException
NV;https://justfacts.votesmart.org/interest-group/2812/nevada-law-enforcement-coalition-nlec,nevada law enforcement coalition nlec,2812,TimeoutException,TimeoutException
NH;https://justfacts.votesmart.org/interest-group/2366/new-hampshire-sierra-club,new hampshire sierra club,2366,New Hampshire Sierra Club State,53388163
NH;https://justfacts.votesmart.org/interest-group/2366/new-hampshire-sierra-club,new hampshire sierra club,2366,Sierra Club New Hampshire Chapter,9820165
NH;https://justfacts.votesmart.org/interest-group/2366/new-hampshire-sierra-club,new hampshire sierra club,2366,Sierra Club Of New Hampshire,27631252
NH;https://justfacts.votesmart.org/interest-group/1861/cornerstone-policy-research,cornerstone policy research,1861,Cornerstone Policy Research & Action,39766941
NH;https://justfacts.votesmart.org/interest-group/2363/new-hampshire-firearms-coalition,new hampshire firearms coalition,2363,New Hampshire Firearms Coalition-Pac,47816887
NH;https://justfacts.votesmart.org/interest-group/2012/new-hampshire-lodging-restaurant-association,new hampshire lodging restaurant association,2012,New Hampshire Lodging & Restaurant Association,8093
NV;https://justfacts.votesmart.org/interest-group/1782/nevada-prosperity-project,nevada prosperity project,1782,TimeoutException,TimeoutException
NH;https://justfacts.votesmart.org/interest-group/2874/new-futures,new futures,2874,New Futures,27631365
NH;https://justfacts.votesmart.org/interest-group/2365/planned-parenthood-new-hampshire-action-fund,planned parenthood new hampshire action fund,2365,Planned Parenthood New Hampshire Action Fund,46755969
NV;https://justfacts.votesmart.org/interest-group/2822/citizens-for-responsible-government-nevada,citizens for responsible government nevada,2822,TimeoutException,TimeoutException
NH;https://justfacts.votesmart.org/interest-group/2477/state-employees-association-of-new-hampshire,state employees association of new hampshire,2477,State Employees Association Of New Hampshire,9750054
NV;https://justfacts.votesmart.org/interest-group/2254/nevada-right-to-life-pac,nevada right to life pac,2254,TimeoutException,TimeoutException
NH;https://justfacts.votesmart.org/interest-group/342/new-hampshire-right-to-life,new hampshire right to life,342,New Hampshire Right To Life,9788713
NH;https://justfacts.votesmart.org/interest-group/333/new-hampshire-citizens-alliance,new hampshire citizens alliance,333,New Hampshire Citizens Alliance,27638847
NH;https://justfacts.votesmart.org/interest-group/2400/new-hampshire-afl-cio,new hampshire afl cio,2400,New Hampshire Afl-Cio,21458
NH;https://justfacts.votesmart.org/interest-group/2400/new-hampshire-afl-cio,new hampshire afl cio,2400,New Hampshire Afl-Cio,48062972
NV;https://justfacts.votesmart.org/interest-group/2017/nevada-policy-research-institute-npri,nevada policy research institute npri,2017,TimeoutException,TimeoutException
NH;https://justfacts.votesmart.org/interest-group/1179/new-hampshire-public-interest-research-group,new hampshire public interest research group,1179,New Hampshire Public Interest Research Group,27631458
NH;https://justfacts.votesmart.org/interest-group/1921/business-and-industry-association,business and industry association,1921,TimeoutException,TimeoutException
NJ;https://justfacts.votesmart.org/interest-group/2193/new-jersey-citizen-action,new jersey citizen action,2193,New Jersey Citizen Action,21777164
NJ;https://justfacts.votesmart.org/interest-group/2193/new-jersey-citizen-action,new jersey citizen action,2193,New Jersey Citizen Action,24794804
NJ;https://justfacts.votesmart.org/interest-group/2193/new-jersey-citizen-action,new jersey citizen action,2193,New Jersey Citizen Action,25493390
NJ;https://justfacts.votesmart.org/interest-group/1869/environment-new-jersey,environment new jersey,1869,Environment New Jersey,19449022
NH;https://justfacts.votesmart.org/interest-group/1967/new-hampshire-families-for-education,new hampshire families for education,1967,TimeoutException,TimeoutException
NJ;https://justfacts.votesmart.org/interest-group/2910/garden-state-equality,garden state equality,2910,Garden State Equality,11000732
NJ;https://justfacts.votesmart.org/interest-group/2910/garden-state-equality,garden state equality,2910,Garden State Equality,11000735
NJ;https://justfacts.votesmart.org/interest-group/2910/garden-state-equality,garden state equality,2910,Garden State Equality,1126201
NJ;https://justfacts.votesmart.org/interest-group/2050/new-jersey-right-to-life,new jersey right to life,2050,New Jersey Right To Life,21116
NJ;https://justfacts.votesmart.org/interest-group/2194/womens-political-caucus-of-new-jersey,womens political caucus of new jersey,2194,Womens Political Caucus Of New Jersey,17202
NH;https://justfacts.votesmart.org/interest-group/2131/republican-liberty-caucus-of-new-hampshire,republican liberty caucus of new hampshire,2131,TimeoutException,TimeoutException
NJ;https://justfacts.votesmart.org/interest-group/1348/new-jersey-citizen-action-pac,new jersey citizen action pac,1348,New Jersey Citizen Action Pac (Njca Pac),40453954
NH;https://justfacts.votesmart.org/interest-group/1644/new-hampshire-house-republican-alliance,new hampshire house republican alliance,1644,TimeoutException,TimeoutException
NH;https://justfacts.votesmart.org/interest-group/1129/national-rifle-association-political-victory-fund,national rifle association political victory fund,1129,TimeoutException,TimeoutException
NH;https://justfacts.votesmart.org/interest-group/1759/national-federation-of-independent-business-new-hampshire,national federation of independent business new hampshire,1759,TimeoutException,TimeoutException
NJ;https://justfacts.votesmart.org/interest-group/1512/new-jersey-public-interest-research-group,new jersey public interest research group,1512,TimeoutException,TimeoutException
NJ;https://justfacts.votesmart.org/interest-group/2613/jneso-the-professional-health-care-union,jneso the professional health care union,2613,TimeoutException,TimeoutException
NJ;https://justfacts.votesmart.org/interest-group/2191/new-jersey-building-and-construction-trades-council-afl-cio,new jersey building and construction trades council afl cio,2191,TimeoutException,TimeoutException
NJ;https://justfacts.votesmart.org/interest-group/3297/probation-association-of-new-jersey,probation association of new jersey,3297,TimeoutException,TimeoutException
NJ;https://justfacts.votesmart.org/interest-group/1878/sierra-club-new-jersey-chapter,sierra club new jersey chapter,1878,Sierra Club New Jersey Chapter,6573922
NJ;https://justfacts.votesmart.org/interest-group/1603/new-jersey-afl-cio,new jersey afl cio,1603,Council Of New Jersey State College Locals Cope-Aft / Afl-Cio Cope,44108936
NJ;https://justfacts.votesmart.org/interest-group/1603/new-jersey-afl-cio,new jersey afl cio,1603,New Jersey State Afl Cio,54448466
NJ;https://justfacts.votesmart.org/interest-group/1603/new-jersey-afl-cio,new jersey afl cio,1603,New Jersey State Afl-Cio,20155
NJ;https://justfacts.votesmart.org/interest-group/2616/the-bricklayers-and-allied-craftworkers-union-of-new-jersey,the bricklayers and allied craftworkers union of new jersey,2616,TimeoutException,TimeoutException
NJ;https://justfacts.votesmart.org/interest-group/2996/family-policy-alliance-of-new-jersey,family policy alliance of new jersey,2996,Family Policy Alliance Of New Jersey,55399809
NJ;https://justfacts.votesmart.org/interest-group/2090/new-jersey-league-of-conservation-voters,new jersey league of conservation voters,2090,New Jersey League Of Conservation Voters,19898745
NJ;https://justfacts.votesmart.org/interest-group/1891/national-association-of-social-workers-new-jersey-chapter,national association of social workers new jersey chapter,1891,New Jersey Chapter National Association Of Social Workers,21107
NJ;https://justfacts.votesmart.org/interest-group/1375/new-jersey-lesbian-and-gay-coalition,new jersey lesbian and gay coalition,1375,TimeoutException,TimeoutException
NJ;https://justfacts.votesmart.org/interest-group/2235/new-jersey-state-firefighters-mutual-benevolent-association,new jersey state firefighters mutual benevolent association,2235,TimeoutException,TimeoutException
NJ;https://justfacts.votesmart.org/interest-group/2190/new-jersey-state-nurses-association,new jersey state nurses association,2190,New Jersey State Nurses Association,10236886
NJ;https://justfacts.votesmart.org/interest-group/2190/new-jersey-state-nurses-association,new jersey state nurses association,2190,New Jersey State Nurses Association,43689196
NJ;https://justfacts.votesmart.org/interest-group/2190/new-jersey-state-nurses-association,new jersey state nurses association,2190,New Jersey State Nurses Association,6421034
NJ;https://justfacts.votesmart.org/interest-group/564/new-jersey-organization-for-a-better-state-pac-new-jobs-pac,new jersey organization for a better state pac new jobs pac,564,TimeoutException,TimeoutException
NJ;https://justfacts.votesmart.org/interest-group/3279/progressive-democrats-of-new-jersey,progressive democrats of new jersey,3279,TimeoutException,TimeoutException
NJ;https://justfacts.votesmart.org/interest-group/1872/republican-liberty-caucus,republican liberty caucus,1872,Republican Liberty Caucus,10244597
NJ;https://justfacts.votesmart.org/interest-group/1872/republican-liberty-caucus,republican liberty caucus,1872,Republican Liberty Caucus,10704656
NJ;https://justfacts.votesmart.org/interest-group/1872/republican-liberty-caucus,republican liberty caucus,1872,Republican Liberty Caucus,11055461
NJ;https://justfacts.votesmart.org/interest-group/1872/republican-liberty-caucus,republican liberty caucus,1872,Republican Liberty Caucus,11270538
NJ;https://justfacts.votesmart.org/interest-group/1872/republican-liberty-caucus,republican liberty caucus,1872,Republican Liberty Caucus,16755873
NJ;https://justfacts.votesmart.org/interest-group/1872/republican-liberty-caucus,republican liberty caucus,1872,Republican Liberty Caucus,1817488
NJ;https://justfacts.votesmart.org/interest-group/1872/republican-liberty-caucus,republican liberty caucus,1872,Republican Liberty Caucus,2002766
NJ;https://justfacts.votesmart.org/interest-group/1872/republican-liberty-caucus,republican liberty caucus,1872,Republican Liberty Caucus,20363931
NJ;https://justfacts.votesmart.org/interest-group/1872/republican-liberty-caucus,republican liberty caucus,1872,Republican Liberty Caucus,24865843
NJ;https://justfacts.votesmart.org/interest-group/1872/republican-liberty-caucus,republican liberty caucus,1872,Republican Liberty Caucus,37064237
NJ;https://justfacts.votesmart.org/interest-group/1872/republican-liberty-caucus,republican liberty caucus,1872,Republican Liberty Caucus,38431755
NJ;https://justfacts.votesmart.org/interest-group/1872/republican-liberty-caucus,republican liberty caucus,1872,Republican Liberty Caucus,38606598
NJ;https://justfacts.votesmart.org/interest-group/1872/republican-liberty-caucus,republican liberty caucus,1872,Republican Liberty Caucus,44645095
NJ;https://justfacts.votesmart.org/interest-group/1872/republican-liberty-caucus,republican liberty caucus,1872,Republican Liberty Caucus,7593920
NJ;https://justfacts.votesmart.org/interest-group/1872/republican-liberty-caucus,republican liberty caucus,1872,Republican Liberty Caucus,8874029
NJ;https://justfacts.votesmart.org/interest-group/1872/republican-liberty-caucus,republican liberty caucus,1872,Republican Liberty Caucus,9954740
NJ;https://justfacts.votesmart.org/interest-group/1883/new-jersey-restaurant-association,new jersey restaurant association,1883,New Jersey Restaurant Association,8134
NJ;https://justfacts.votesmart.org/interest-group/1881/planned-parenthood-action-fund-of-new-jersey,planned parenthood action fund of new jersey,1881,TimeoutException,TimeoutException
NJ;https://justfacts.votesmart.org/interest-group/2909/pams-list,pams list,2909,"List, Pams",49658205
NJ;https://justfacts.votesmart.org/interest-group/2909/pams-list,pams list,2909,Pams List The Womens Coalition,14895
NJ;https://justfacts.votesmart.org/interest-group/2909/pams-list,pams list,2909,Pams List Womens Coalition,6714875
NJ;https://justfacts.votesmart.org/interest-group/2909/pams-list,pams list,2909,The Womens Coalition- Pams List,19888465
NJ;https://justfacts.votesmart.org/interest-group/2909/pams-list,pams list,2909,Womens Coalition-Pams List,6557331
NJ;https://justfacts.votesmart.org/interest-group/2617/the-new-york-hotel-and-motel-trades-council-afl-cio-new-jersey-chapter,the new york hotel and motel trades council afl cio new jersey chapter,2617,TimeoutException,TimeoutException
NJ;https://justfacts.votesmart.org/interest-group/3293/latina-civic-pac,latina civic pac,3293,TimeoutException,TimeoutException
NJ;https://justfacts.votesmart.org/interest-group/1885/new-jersey-outdoor-alliance,new jersey outdoor alliance,1885,New Jersey Outdoor Alliance,6422099
NJ;https://justfacts.votesmart.org/interest-group/3280/good-government-coalition-of-new-jersey,good government coalition of new jersey,3280,TimeoutException,TimeoutException
NJ;https://justfacts.votesmart.org/interest-group/1191/new-jersey-public-health-association,new jersey public health association,1191,TimeoutException,TimeoutException
NJ;https://justfacts.votesmart.org/interest-group/756/national-rifle-association-political-victory-fund,national rifle association political victory fund,756,TimeoutException,TimeoutException
NJ;https://justfacts.votesmart.org/interest-group/2615/new-jersey-superior-officers-association-njsoa,new jersey superior officers association njsoa,2615,TimeoutException,TimeoutException
NJ;https://justfacts.votesmart.org/interest-group/2911/marias-women-united,marias women united,2911,Marias Women United,44105279
NJ;https://justfacts.votesmart.org/interest-group/3146/south-jersey-progressive-democrats,south jersey progressive democrats,3146,TimeoutException,TimeoutException
NJ;https://justfacts.votesmart.org/interest-group/2580/american-federation-of-teachers-new-jersey-afl-cio,american federation of teachers new jersey afl cio,2580,TimeoutException,TimeoutException
NJ;https://justfacts.votesmart.org/interest-group/531/new-jersey-chamber-of-commerce,new jersey chamber of commerce,531,Chamber Of Commerce Southern New Jersey,24794651
NJ;https://justfacts.votesmart.org/interest-group/531/new-jersey-chamber-of-commerce,new jersey chamber of commerce,531,New Jersey State Chamber Of Commerce,6609283
NJ;https://justfacts.votesmart.org/interest-group/531/new-jersey-chamber-of-commerce,new jersey chamber of commerce,531,Southern New Jersey Chamber Of Commerce,10871002
NJ;https://justfacts.votesmart.org/interest-group/1511/naral-pro-choice-new-jersey,naral pro choice new jersey,1511,Naral Pro-Choice New Jersey,16502431
NJ;https://justfacts.votesmart.org/interest-group/3080/32bj-service-employees-international-union-seiu-new-jersey,32bj service employees international union seiu new jersey,3080,TimeoutException,TimeoutException
NJ;https://justfacts.votesmart.org/interest-group/1888/new-jersey-fraternal-order-of-police,new jersey fraternal order of police,1888,Fraternal Order Of Police New Jersey State Lodge 4,31616416
NJ;https://justfacts.votesmart.org/interest-group/1888/new-jersey-fraternal-order-of-police,new jersey fraternal order of police,1888,Fraternal Order Of Police New Jersey State Lodge P Ac,54291504
NJ;https://justfacts.votesmart.org/interest-group/1888/new-jersey-fraternal-order-of-police,new jersey fraternal order of police,1888,Fraternal Order Of Police New Jersey State Lodge P Ac Fop,54410217
NJ;https://justfacts.votesmart.org/interest-group/1888/new-jersey-fraternal-order-of-police,new jersey fraternal order of police,1888,Fraternal Order Of Police New Jersey State Lodge Pac Fop,48860475
NJ;https://justfacts.votesmart.org/interest-group/1888/new-jersey-fraternal-order-of-police,new jersey fraternal order of police,1888,Fraternal Order Of The Police New Jersey State Lodge,44108530
NJ;https://justfacts.votesmart.org/interest-group/1888/new-jersey-fraternal-order-of-police,new jersey fraternal order of police,1888,New Jersey State Lodge Fraternal Order Of Police,23415023
NJ;https://justfacts.votesmart.org/interest-group/323/national-federation-of-independent-business-new-jersey,national federation of independent business new jersey,323,National Federation Of Independent Business New Jersey,44107872
NJ;https://justfacts.votesmart.org/interest-group/3149/force-the-issue-nj,force the issue nj,3149,TimeoutException,TimeoutException
NJ;https://justfacts.votesmart.org/interest-group/371/right-to-choose,right to choose,371,Right To Choose,10187632
NJ;https://justfacts.votesmart.org/interest-group/2831/new-jersey-now-national-organization-for-women,new jersey now national organization for women,2831,TimeoutException,TimeoutException
NJ;https://justfacts.votesmart.org/interest-group/2614/northeast-regional-council-of-carpenters,northeast regional council of carpenters,2614,Northeast Regional Council Of Carpenters,44954359
NJ;https://justfacts.votesmart.org/interest-group/2614/northeast-regional-council-of-carpenters,northeast regional council of carpenters,2614,Northeast Regional Council Of Carpenters,6871914
NJ;https://justfacts.votesmart.org/interest-group/2599/anti-racist-alliance,anti racist alliance,2599,TimeoutException,TimeoutException
NJ;https://justfacts.votesmart.org/interest-group/2255/professional-firefighters-association-of-new-jersey,professional firefighters association of new jersey,2255,TimeoutException,TimeoutException
NJ;https://justfacts.votesmart.org/interest-group/680/new-jersey-education-association,new jersey education association,680,New Jersey Education Association,20252
NM;https://justfacts.votesmart.org/interest-group/422/new-mexico-shooting-sports-association,new mexico shooting sports association,422,New Mexico Shooting Sports Association,9103749
NM;https://justfacts.votesmart.org/interest-group/422/new-mexico-shooting-sports-association,new mexico shooting sports association,422,New Mexico Shooting Sports Association,9256466
NM;https://justfacts.votesmart.org/interest-group/2744/rio-grande-foundation,rio grande foundation,2744,Rio Grande Foundation,46862890
NM;https://justfacts.votesmart.org/interest-group/2714/new-mexico-professional-fire-fighters-association,new mexico professional fire fighters association,2714,New Mexico Professional Fire Fighters Association,8934844
NJ;https://justfacts.votesmart.org/interest-group/1887/health-professionals-and-allied-employees,health professionals and allied employees,1887,TimeoutException,TimeoutException
NM;https://justfacts.votesmart.org/interest-group/1635/new-mexico-public-interest-research-group,new mexico public interest research group,1635,New Mexico Public Interest Research Group,10953792
NM;https://justfacts.votesmart.org/interest-group/1635/new-mexico-public-interest-research-group,new mexico public interest research group,1635,New Mexico Public Interest Research Group,27655176
NM;https://justfacts.votesmart.org/interest-group/2743/common-cause-new-mexico,common cause new mexico,2743,Common Cause New Mexico,27638216
NM;https://justfacts.votesmart.org/interest-group/2743/common-cause-new-mexico,common cause new mexico,2743,Common Cause New Mexico,54703478
NM;https://justfacts.votesmart.org/interest-group/1825/environment-new-mexico,environment new mexico,1825,Environment New Mexico,18929576
NM;https://justfacts.votesmart.org/interest-group/1377/sierra-club-rio-grande-chapter,sierra club rio grande chapter,1377,Sierra Club Rio Grande Chapter,9021789
NM;https://justfacts.votesmart.org/interest-group/414/american-federation-of-teachers-new-mexico,american federation of teachers new mexico,414,American Federation Of Teachers New Mexico,50000399
NM;https://justfacts.votesmart.org/interest-group/797/new-mexico-federation-of-labor-afl-cio,new mexico federation of labor afl cio,797,"Ashley New Mexico Federation Of Labor, Afl-Cio",52835974
NM;https://justfacts.votesmart.org/interest-group/797/new-mexico-federation-of-labor-afl-cio,new mexico federation of labor afl cio,797,New Mexico Federation Of Labor Afl-Cio,3004
NM;https://justfacts.votesmart.org/interest-group/1592/right-to-life-committee-of-new-mexico,right to life committee of new mexico,1592,Right To Life Committee Of New Mexico,27673339
NM;https://justfacts.votesmart.org/interest-group/2699/unite-new-mexico,unite new mexico,2699,Arizona New Mexico Victory Fund-Unitemized,49411124
NM;https://justfacts.votesmart.org/interest-group/2699/unite-new-mexico,unite new mexico,2699,New Mexico Indivisible United,51093201
NM;https://justfacts.votesmart.org/interest-group/2699/unite-new-mexico,unite new mexico,2699,New Mexico State Legislative Board United Transportation Union,20970
NM;https://justfacts.votesmart.org/interest-group/2699/unite-new-mexico,unite new mexico,2699,New Mexico United,53503811
NM;https://justfacts.votesmart.org/interest-group/2699/unite-new-mexico,unite new mexico,2699,New Mexico Unites For Marriage,32477232
NM;https://justfacts.votesmart.org/interest-group/2699/unite-new-mexico,unite new mexico,2699,New Mexico Vecinos United,27638750
NM;https://justfacts.votesmart.org/interest-group/2699/unite-new-mexico,unite new mexico,2699,United Blood Services Of New Mexico,27638652
NM;https://justfacts.votesmart.org/interest-group/2699/unite-new-mexico,unite new mexico,2699,United Chiropractors Of New Mexico Presidents Circle,9216546
NM;https://justfacts.votesmart.org/interest-group/2699/unite-new-mexico,unite new mexico,2699,United For New Mexico,49890515
NM;https://justfacts.votesmart.org/interest-group/2699/unite-new-mexico,unite new mexico,2699,United Way Of Eastern New Mexico,44660508
NM;https://justfacts.votesmart.org/interest-group/2699/unite-new-mexico,unite new mexico,2699,United Way Of Northern New Mexico,45692960
NJ;https://justfacts.votesmart.org/interest-group/2612/service-employees-international-union-seiu-new-jersey-state-council,service employees international union seiu new jersey state council,2612,TimeoutException,TimeoutException
NM;https://justfacts.votesmart.org/interest-group/1030/national-federation-of-independent-business-new-mexico,national federation of independent business new mexico,1030,National Federation Of Independent Business New Mexico,46888373
NM;https://justfacts.votesmart.org/interest-group/2712/our-revolution-new-mexico,our revolution new mexico,2712,TimeoutException,TimeoutException
NJ;https://justfacts.votesmart.org/interest-group/2015/new-jersey-taxpayers-alliance,new jersey taxpayers alliance,2015,TimeoutException,TimeoutException
NM;https://justfacts.votesmart.org/interest-group/2713/organizers-in-the-land-of-enchantment-ole,organizers in the land of enchantment ole,2713,TimeoutException,TimeoutException
NY;https://justfacts.votesmart.org/interest-group/399/new-york-state-public-employees-federation,new york state public employees federation,399,New York State Public Employees Federation,19165
