vs_link,vs_name,vs_id,ftm_name,ftm_id
AL;https://justfacts.votesmart.org/interest-group/369/eagle-forum-of-alabama,eagle forum of alabama,369,Eagle Forum Of Alabama,27603510
AL;https://justfacts.votesmart.org/interest-group/2586/business-council-of-alabama,business council of alabama,2586,Business Council Of Alabama,6973410
AL;https://justfacts.votesmart.org/interest-group/2587/alabama-grocers-association,alabama grocers association,2587,Alabama Grocers Association,5680
AL;https://justfacts.votesmart.org/interest-group/2952/professional-fire-fighters-of-alabama,professional fire fighters of alabama,2952,Professional Fire Fighters Association Of Alabama,19461
AL;https://justfacts.votesmart.org/interest-group/608/national-federation-of-independent-business-alabama,national federation of independent business alabama,608,National Federation Of Independent Business Alabama,46875331
AL;https://justfacts.votesmart.org/interest-group/1991/league-of-southeastern-credit-unions,league of southeastern credit unions,1991,League Of Southeastern Credit Unions,39500224
AL;https://justfacts.votesmart.org/interest-group/1991/league-of-southeastern-credit-unions,league of southeastern credit unions,1991,League Of Southeastern Credit Unions,7072959
AL;https://justfacts.votesmart.org/interest-group/1454/alabama-state-employees-association,alabama state employees association,1454,Alabama State Employees Association,3061
AL;https://justfacts.votesmart.org/interest-group/2593/alabama-retail-association,alabama retail association,2593,Alabama Retailers Association,29616080
AL;https://justfacts.votesmart.org/interest-group/2593/alabama-retail-association,alabama retail association,2593,"Retail Association, Alabama",27603298
AL;https://justfacts.votesmart.org/interest-group/2593/alabama-retail-association,alabama retail association,2593,Retailers Association Of Alabama,55657698
AK;https://justfacts.votesmart.org/interest-group/689/alaska-state-chamber-of-commerce,alaska state chamber of commerce,689,Alaska State Chamber Of Commerce,21488
AK;https://justfacts.votesmart.org/interest-group/213/national-education-association-alaska,national education association alaska,213,National Education Association Alaska,7535011
AL;https://justfacts.votesmart.org/interest-group/2201/conservative-christians-of-alabama,conservative christians of alabama,2201,TimeoutException,TimeoutException
AL;https://justfacts.votesmart.org/interest-group/2588/home-builders-of-association-of-alabama,home builders of association of alabama,2588,TimeoutException,TimeoutException
AL;https://justfacts.votesmart.org/interest-group/3024/south-alabama-common-sense-campaign-tea-party,south alabama common sense campaign tea party,3024,TimeoutException,TimeoutException
AK;https://justfacts.votesmart.org/interest-group/2807/the-alaska-center,the alaska center,2807,Alaska Center For The Environment,10984504
AK;https://justfacts.votesmart.org/interest-group/2807/the-alaska-center,the alaska center,2807,The Alaska Center Ie,53917523
AK;https://justfacts.votesmart.org/interest-group/2095/alaska-support-industry-alliance,alaska support industry alliance,2095,Alaska Support Industry Alliance,10239759
AL;https://justfacts.votesmart.org/interest-group/1557/national-rifle-association-political-victory-fund,national rifle association political victory fund,1557,TimeoutException,TimeoutException
AK;https://justfacts.votesmart.org/interest-group/1990/prosperity-alaska,prosperity alaska,1990,Prosperity Alaska,32207180
AK;https://justfacts.votesmart.org/interest-group/1162/alaska-outdoor-council-pac,alaska outdoor council pac,1162,TimeoutException,TimeoutException
AK;https://justfacts.votesmart.org/interest-group/2160/associated-builders-and-contractors-of-alaska,associated builders and contractors of alaska,2160,TimeoutException,TimeoutException
AK;https://justfacts.votesmart.org/interest-group/2096/resource-development-council-for-alaska,resource development council for alaska,2096,Resource Development Council For Alaska,10239770
AK;https://justfacts.votesmart.org/interest-group/2825/alaska-professional-fire-fighters-association,alaska professional fire fighters association,2825,Alaska Professional Fire Fighters Association,19431
AK;https://justfacts.votesmart.org/interest-group/2998/anchorage-education-association,anchorage education association,2998,TimeoutException,TimeoutException
AK;https://justfacts.votesmart.org/interest-group/2868/the-alaska-fathers-rights-movement,the alaska fathers rights movement,2868,TimeoutException,TimeoutException
AK;https://justfacts.votesmart.org/interest-group/2467/planned-parenthood-votes-northwest-and-hawaii,planned parenthood votes northwest and hawaii,2467,TimeoutException,TimeoutException
AK;https://justfacts.votesmart.org/interest-group/1388/alaska-public-employees-association-alaska-federation-of-teachers,alaska public employees association alaska federation of teachers,1388,TimeoutException,TimeoutException
AK;https://justfacts.votesmart.org/interest-group/356/national-federation-of-independent-business-alaska,national federation of independent business alaska,356,TimeoutException,TimeoutException
AZ;https://justfacts.votesmart.org/interest-group/123/arizona-education-association,arizona education association,123,Arizona Education Association,20198
AZ;https://justfacts.votesmart.org/interest-group/91/naralarizona-right-to-choose,naralarizona right to choose,91,TimeoutException,TimeoutException
AZ;https://justfacts.votesmart.org/interest-group/1252/arizona-nurses-association,arizona nurses association,1252,Arizona Nurses Association,26802601
AZ;https://justfacts.votesmart.org/interest-group/1252/arizona-nurses-association,arizona nurses association,1252,Arizona Nurses Association,8569540
AZ;https://justfacts.votesmart.org/interest-group/1423/arizona-police-association,arizona police association,1423,Arizona Police Association,10245094
AZ;https://justfacts.votesmart.org/interest-group/1433/center-for-arizona-policy,center for arizona policy,1433,Center For Arizona Policy,10968
AZ;https://justfacts.votesmart.org/interest-group/2078/arizona-small-business-association,arizona small business association,2078,Arizona Small Business Association,10945076
AZ;https://justfacts.votesmart.org/interest-group/259/arizona-contractors-association,arizona contractors association,259,Arizona Contractors Association,8425223
AZ;https://justfacts.votesmart.org/interest-group/2367/stonewall-democrats-of-arizona,stonewall democrats of arizona,2367,Stonewall Democrats Of Arizona,8709376
AZ;https://justfacts.votesmart.org/interest-group/2351/associated-general-contractors,associated general contractors,2351,Associated General Contractors,48059673
AZ;https://justfacts.votesmart.org/interest-group/2351/associated-general-contractors,associated general contractors,2351,Associated General Contractors,54267071
AZ;https://justfacts.votesmart.org/interest-group/768/arizona-state-afl-cio,arizona state afl cio,768,Arizona State Afl Cio,52433113
AZ;https://justfacts.votesmart.org/interest-group/2870/childrens-action-alliance,childrens action alliance,2870,Childrens Action Alliance,8559737
AZ;https://justfacts.votesmart.org/interest-group/1091/equality-arizona,equality arizona,1091,Equality Arizona,8425554
AZ;https://justfacts.votesmart.org/interest-group/150/planned-parenthood-advocates-of-arizona,planned parenthood advocates of arizona,150,Planned Parenthood Advocates Of Arizona In-Kind,48131478
AZ;https://justfacts.votesmart.org/interest-group/1054/arizona-chamber-of-commerce-and-industry,arizona chamber of commerce and industry,1054,TimeoutException,TimeoutException
AZ;https://justfacts.votesmart.org/interest-group/279/arizona-disability-advocacy-coalition,arizona disability advocacy coalition,279,TimeoutException,TimeoutException
AZ;https://justfacts.votesmart.org/interest-group/3089/az-youth-climate-coalition,az youth climate coalition,3089,TimeoutException,TimeoutException
AZ;https://justfacts.votesmart.org/interest-group/155/sierra-club-grand-canyon-chapter,sierra club grand canyon chapter,155,Sierra Club Grand Canyon Chapter,8560914
AZ;https://justfacts.votesmart.org/interest-group/2205/arizona-womens-political-caucus,arizona womens political caucus,2205,Arizona Womens Political Caucus,8889466
AZ;https://justfacts.votesmart.org/interest-group/2869/tucson-metro-chamber,tucson metro chamber,2869,Tucson Metro Chamber,42115549
AZ;https://justfacts.votesmart.org/interest-group/1085/helping-arizona-limit-tragedy-halt,helping arizona limit tragedy halt,1085,TimeoutException,TimeoutException
AZ;https://justfacts.votesmart.org/interest-group/3046/arizona-medical-political-action-committee,arizona medical political action committee,3046,TimeoutException,TimeoutException
AZ;https://justfacts.votesmart.org/interest-group/2206/arizona-list,arizona list,2206,Arizona List,8425625
AZ;https://justfacts.votesmart.org/interest-group/2088/arizona-economic-development-practitioners,arizona economic development practitioners,2088,TimeoutException,TimeoutException
AZ;https://justfacts.votesmart.org/interest-group/519/united-for-arizona,united for arizona,519,Arizona Families United For Strong Communities,20367
AZ;https://justfacts.votesmart.org/interest-group/519/united-for-arizona,united for arizona,519,Arizona United For Immigration Reform,5822
AZ;https://justfacts.votesmart.org/interest-group/519/united-for-arizona,united for arizona,519,Living United For Change In Arizona,41152732
AR;https://justfacts.votesmart.org/interest-group/2456/planned-parenthood-voters-of-arkansas,planned parenthood voters of arkansas,2456,Planned Parenthood Voters Of Arkansas,43135025
AZ;https://justfacts.votesmart.org/interest-group/2/national-federation-of-independent-business-arizona,national federation of independent business arizona,2,TimeoutException,TimeoutException
AR;https://justfacts.votesmart.org/interest-group/1244/national-federation-of-independent-business-arkansas,national federation of independent business arkansas,1244,National Federation Of Independent Business Arkansas,42114298
AR;https://justfacts.votesmart.org/interest-group/2871/family-council,family council,2871,Family Council,3478157
AR;https://justfacts.votesmart.org/interest-group/2871/family-council,family council,2871,Family Council,9714191
AZ;https://justfacts.votesmart.org/interest-group/2944/unite-here-local-11-arizona,unite here local 11 arizona,2944,TimeoutException,TimeoutException
AR;https://justfacts.votesmart.org/interest-group/2857/arkansas-state-employees-association,arkansas state employees association,2857,Arkansas State Employees Association,13668775
AR;https://justfacts.votesmart.org/interest-group/2857/arkansas-state-employees-association,arkansas state employees association,2857,Arkansas State Employees Association,9623497
AR;https://justfacts.votesmart.org/interest-group/1140/arkansas-afl-cio,arkansas afl cio,1140,Arkansas Afl-Cio,20129
AR;https://justfacts.votesmart.org/interest-group/1140/arkansas-afl-cio,arkansas afl cio,1140,Arkansas Afl-Cio Young Workers Conference,40802150
AR;https://justfacts.votesmart.org/interest-group/1140/arkansas-afl-cio,arkansas afl cio,1140,Peaint Arkansas Afl-Cio,9850262
AR;https://justfacts.votesmart.org/interest-group/2575/conduit-for-commerce,conduit for commerce,2575,Conduit For Commerce,16129041
AR;https://justfacts.votesmart.org/interest-group/2209/conservative-arkansas,conservative arkansas,2209,Conservative Arkansas,9620249
AR;https://justfacts.votesmart.org/interest-group/106/arkansas-citizens-first-congress,arkansas citizens first congress,106,Arkansas Citizens First Congress,27649580
AZ;https://justfacts.votesmart.org/interest-group/1597/national-rifle-association-political-victory-fund,national rifle association political victory fund,1597,TimeoutException,TimeoutException
AZ;https://justfacts.votesmart.org/interest-group/1994/arizona-hospital-and-healthcare-association,arizona hospital and healthcare association,1994,TimeoutException,TimeoutException
CA;https://justfacts.votesmart.org/interest-group/1594/california-labor-federation,california labor federation,1594,California Labor Federation Afl-Cio,20131
CA;https://justfacts.votesmart.org/interest-group/1594/california-labor-federation,california labor federation,1594,California State Federation Of Labor,53933497
CA;https://justfacts.votesmart.org/interest-group/1594/california-labor-federation,california labor federation,1594,"Coalition To Protect Riders & Drivers, Sponsored By The California Labor Federation, Afl-Cio",50229752
CA;https://justfacts.votesmart.org/interest-group/1594/california-labor-federation,california labor federation,1594,"Million More Voters, Sponsored By The California Labor Federation Afl-Cio",47593704
CA;https://justfacts.votesmart.org/interest-group/1594/california-labor-federation,california labor federation,1594,Million More Voters-Sponsered By The California Labor Federation Afl-Cio,47418987
CA;https://justfacts.votesmart.org/interest-group/1594/california-labor-federation,california labor federation,1594,Standing Committee On Political Education Of The California Labor Federation Afl-Cio Scc,47116798
CA;https://justfacts.votesmart.org/interest-group/1594/california-labor-federation,california labor federation,1594,Standing Committee On Political Education Of The California Labor Federation Small Contributor Committee,49314582
CA;https://justfacts.votesmart.org/interest-group/1594/california-labor-federation,california labor federation,1594,"Standing Committee On Political Education Of The California Labor Federation, Afl-Cio- Small Contributor Committee",44597525
CA;https://justfacts.votesmart.org/interest-group/2212/honor-pac,honor pac,2212,Honor Pac,10243946
CA;https://justfacts.votesmart.org/interest-group/2212/honor-pac,honor pac,2212,Honor Pac,7214686
CA;https://justfacts.votesmart.org/interest-group/220/california-farm-bureau-federation,california farm bureau federation,220,California Farm Bureau Federation,3622
CA;https://justfacts.votesmart.org/interest-group/2527/california-environmental-justice-alliance,california environmental justice alliance,2527,California Environmental Justice Alliance,24577229
CA;https://justfacts.votesmart.org/interest-group/3257/california-young-democrats,california young democrats,3257,California Young Democrats,10245154
CA;https://justfacts.votesmart.org/interest-group/3257/california-young-democrats,california young democrats,3257,California Young Democrats,1262608
CA;https://justfacts.votesmart.org/interest-group/3257/california-young-democrats,california young democrats,3257,California Young Democrats,29261806
CA;https://justfacts.votesmart.org/interest-group/1979/professional-engineers-in-california-government,professional engineers in california government,1979,Professional Engineers In California Government,4414
CA;https://justfacts.votesmart.org/interest-group/691/national-tax-limitation-committee,national tax limitation committee,691,National Tax Limitation Committee,2285950
CA;https://justfacts.votesmart.org/interest-group/1923/california-federation-of-teachers,california federation of teachers,1923,California Federation Of Teachers,19198
CA;https://justfacts.votesmart.org/interest-group/1923/california-federation-of-teachers,california federation of teachers,1923,California Federation Of Teachers,48495805
CA;https://justfacts.votesmart.org/interest-group/2491/national-union-of-healthcare-workers,national union of healthcare workers,2491,National Union Of Healthcare Workers,16933737
AZ;https://justfacts.votesmart.org/interest-group/713/arizona-state-rifle-and-pistol-association,arizona state rifle and pistol association,713,TimeoutException,TimeoutException
CA;https://justfacts.votesmart.org/interest-group/2632/democrats-for-neighborhood-action,democrats for neighborhood action,2632,Democrats For Neighborhood Action,13811002
CA;https://justfacts.votesmart.org/interest-group/2993/national-womens-political-caucus-california,national womens political caucus california,2993,National Womens Political Caucus (Nwpc) Of California Pac,29030054
CA;https://justfacts.votesmart.org/interest-group/2993/national-womens-political-caucus-california,national womens political caucus california,2993,National Womens Political Caucus California Pac Nwpc Ca,53396632
CA;https://justfacts.votesmart.org/interest-group/2993/national-womens-political-caucus-california,national womens political caucus california,2993,National Womens Political Caucus California State,2400840
CA;https://justfacts.votesmart.org/interest-group/2993/national-womens-political-caucus-california,national womens political caucus california,2993,National Womens Political Caucus California Womens Leadership Fund,49319620
CA;https://justfacts.votesmart.org/interest-group/2993/national-womens-political-caucus-california,national womens political caucus california,2993,National Womens Political Caucus Nwpc California,52373841
CA;https://justfacts.votesmart.org/interest-group/2993/national-womens-political-caucus-california,national womens political caucus california,2993,National Womens Political Caucus Of California,14428
CA;https://justfacts.votesmart.org/interest-group/2993/national-womens-political-caucus-california,national womens political caucus california,2993,National Womens Political Caucus Of California (Nwpc Ca) Pac,752862
CA;https://justfacts.votesmart.org/interest-group/2993/national-womens-political-caucus-california,national womens political caucus california,2993,National Womens Political Caucus Of California (Nwpc) Pac,32877966
CA;https://justfacts.votesmart.org/interest-group/2993/national-womens-political-caucus-california,national womens political caucus california,2993,National Womens Political Caucus Of California Pa,48127463
CA;https://justfacts.votesmart.org/interest-group/2993/national-womens-political-caucus-california,national womens political caucus california,2993,National Womens Political Caucus Of California Pac,1950675
CA;https://justfacts.votesmart.org/interest-group/2993/national-womens-political-caucus-california,national womens political caucus california,2993,National Womens Political Caucus Of California Pac Nwpc,43486184
CA;https://justfacts.votesmart.org/interest-group/2993/national-womens-political-caucus-california,national womens political caucus california,2993,National Womens Political Caucus Of California Pac Nwpcca,49311070
CA;https://justfacts.votesmart.org/interest-group/2993/national-womens-political-caucus-california,national womens political caucus california,2993,National Womens Political Caucus Of California Pac Small Contributor Committee,46525819
CA;https://justfacts.votesmart.org/interest-group/2993/national-womens-political-caucus-california,national womens political caucus california,2993,National Womens Political Caucus-California Caucus,46525515
AR;https://justfacts.votesmart.org/interest-group/836/arkansas-rifle-and-pistol-association,arkansas rifle and pistol association,836,TimeoutException,TimeoutException
CA;https://justfacts.votesmart.org/interest-group/2268/california-teachers-association,california teachers association,2268,California Teachers Association,20205
CA;https://justfacts.votesmart.org/interest-group/1004/naral-pro-choice-california,naral pro choice california,1004,Naral Pro Choice California,1801
AR;https://justfacts.votesmart.org/interest-group/274/american-family-association-of-arkansas,american family association of arkansas,274,TimeoutException,TimeoutException
AR;https://justfacts.votesmart.org/interest-group/298/national-rifle-association-political-victory-fund,national rifle association political victory fund,298,TimeoutException,TimeoutException
CA;https://justfacts.votesmart.org/interest-group/1019/california-chamber-of-commerce,california chamber of commerce,1019,California Chamber Of Commerce,17299
CA;https://justfacts.votesmart.org/interest-group/1019/california-chamber-of-commerce,california chamber of commerce,1019,California Chamber Of Commerce,48004153
CA;https://justfacts.votesmart.org/interest-group/2445/democrats-for-israel-los-angeles,democrats for israel los angeles,2445,Democrats For Israel Los Angeles State,53403692
CA;https://justfacts.votesmart.org/interest-group/2445/democrats-for-israel-los-angeles,democrats for israel los angeles,2445,Democrats For Israel- Los Angeles,55392448
CA;https://justfacts.votesmart.org/interest-group/2522/university-of-california-student-association,university of california student association,2522,University Of California Student Association,24357381
CA;https://justfacts.votesmart.org/interest-group/127/california-faculty-association,california faculty association,127,California Faculty Association,3288
CA;https://justfacts.votesmart.org/interest-group/881/jericho,jericho,881,Jericho,32273155
CA;https://justfacts.votesmart.org/interest-group/2638/national-association-of-social-workers-california,national association of social workers california,2638,California Chapter National Association Of Social Workers,18945
CA;https://justfacts.votesmart.org/interest-group/2638/national-association-of-social-workers-california,national association of social workers california,2638,National Association Of Social Workers California Political Action For Candidate Election Calpace,46525556
CA;https://justfacts.votesmart.org/interest-group/2638/national-association-of-social-workers-california,national association of social workers california,2638,National Association Of Social Workers Calpace California Political Action For Candidate Election,52374366
CA;https://justfacts.votesmart.org/interest-group/589/california-communities-united-institute,california communities united institute,589,TimeoutException,TimeoutException
CA;https://justfacts.votesmart.org/interest-group/792/howard-jarvis-taxpayers-association,howard jarvis taxpayers association,792,Howard Jarvis Taxpayers Association,12970
CA;https://justfacts.votesmart.org/interest-group/124/gun-owners-of-california,gun owners of california,124,Gun Owners Of California,375639
CA;https://justfacts.votesmart.org/interest-group/2437/spirit-of-democracy,spirit of democracy,2437,Spirit Of Democracy America,18929155
CA;https://justfacts.votesmart.org/interest-group/2437/spirit-of-democracy,spirit of democracy,2437,Spirit Of Democracy California,16741307
CA;https://justfacts.votesmart.org/interest-group/3256/association-for-los-angeles-deputy-sheriffs-alads,association for los angeles deputy sheriffs alads,3256,TimeoutException,TimeoutException
CA;https://justfacts.votesmart.org/interest-group/2083/republican-liberty-caucus-of-california,republican liberty caucus of california,2083,TimeoutException,TimeoutException
CA;https://justfacts.votesmart.org/interest-group/2262/california-professional-firefighters,california professional firefighters,2262,California Professional Firefighters Cpf,49313499
CA;https://justfacts.votesmart.org/interest-group/2262/california-professional-firefighters,california professional firefighters,2262,California Professional Firefighters Pac Small Contributor Commitee,54264837
CA;https://justfacts.votesmart.org/interest-group/2262/california-professional-firefighters,california professional firefighters,2262,California Professional Firefightersac,49305404
CA;https://justfacts.votesmart.org/interest-group/1698/environment-california,environment california,1698,"Association Of Environmental & Engineering Geologists, Southern California Section",28755822
CA;https://justfacts.votesmart.org/interest-group/1698/environment-california,environment california,1698,California Association Of Environmental Health Administrators,24574752
CA;https://justfacts.votesmart.org/interest-group/1698/environment-california,environment california,1698,California Conference Directors Environmental Health,32210240
CA;https://justfacts.votesmart.org/interest-group/1698/environment-california,environment california,1698,California Conference Of Directors Of Environmental Health (Ccdeh),36596067
CA;https://justfacts.votesmart.org/interest-group/1698/environment-california,environment california,1698,California Council For Environmental & Economic,47921531
CA;https://justfacts.votesmart.org/interest-group/1698/environment-california,environment california,1698,California Council For Environmental & Economic Balance,24357345
CA;https://justfacts.votesmart.org/interest-group/1698/environment-california,environment california,1698,California Council For Environmental Balance Cceeb,43617858
CA;https://justfacts.votesmart.org/interest-group/1698/environment-california,environment california,1698,California Environmental,1334630
CA;https://justfacts.votesmart.org/interest-group/1698/environment-california,environment california,1698,California Environmental & Resource Associates,38188511
CA;https://justfacts.votesmart.org/interest-group/1698/environment-california,environment california,1698,California Environmental Compa,49312365
CA;https://justfacts.votesmart.org/interest-group/1698/environment-california,environment california,1698,California Environmental Controls Inc,1999178
CA;https://justfacts.votesmart.org/interest-group/1698/environment-california,environment california,1698,California Environmental Health Initiative,48841057
CA;https://justfacts.votesmart.org/interest-group/1698/environment-california,environment california,1698,California Environmental Health Initiative,50170458
CA;https://justfacts.votesmart.org/interest-group/1698/environment-california,environment california,1698,California Environmental Justice Alliance,24577229
