vs_link,vs_name,vs_id,ftm_name,ftm_idWI;https://justfacts.votesmart.org/interest-group/2957/women-lead,women lead,2957,Missouri Womens Leadership Coalition Mwlc,46056338
WI;https://justfacts.votesmart.org/interest-group/2957/women-lead,women lead,2957,Missouri Womens Leadership Coalition Pac Mwlc Mecid C171307,47269000
WI;https://justfacts.votesmart.org/interest-group/2957/women-lead,women lead,2957,Missouri Womens Leadership Committee,47272659
WI;https://justfacts.votesmart.org/interest-group/2957/women-lead,women lead,2957,Mo Womens Leadership Coalition,43538373
WI;https://justfacts.votesmart.org/interest-group/2957/women-lead,women lead,2957,Mo Womens Leadership Coalition Inc,43530363
WI;https://justfacts.votesmart.org/interest-group/2957/women-lead,women lead,2957,Monroe County Democratic Cmte Womens Leaders,5200717
WI;https://justfacts.votesmart.org/interest-group/2957/women-lead,women lead,2957,Mont Co Repub Womens Leadership,25487770
WI;https://justfacts.votesmart.org/interest-group/2957/women-lead,women lead,2957,Montco Dem Womens Leadership,31856854
WI;https://justfacts.votesmart.org/interest-group/2957/women-lead,women lead,2957,Montco Dem Womens Leadership Initiative,31810713
WI;https://justfacts.votesmart.org/interest-group/2957/women-lead,women lead,2957,Montco Democratic Womens Leadership Initiative,31810823
WI;https://justfacts.votesmart.org/interest-group/2957/women-lead,women lead,2957,Montco Dems Womens Leadership Initiative,43107667
WI;https://justfacts.votesmart.org/interest-group/2957/women-lead,women lead,2957,Montco Republican Womens Leadership,43108094
WI;https://justfacts.votesmart.org/interest-group/2957/women-lead,women lead,2957,Montgomery Co Dem Womens Lead Init,47748956
WI;https://justfacts.votesmart.org/interest-group/2957/women-lead,women lead,2957,Montgomery Co Rep Womens Leadership,44000640
WI;https://justfacts.votesmart.org/interest-group/2957/women-lead,women lead,2957,Montgomery Co Republicans Womens Leadership,52690250
WI;https://justfacts.votesmart.org/interest-group/2957/women-lead,women lead,2957,Montgomery County Democratic Women Leadership Initiative,49070197
WI;https://justfacts.votesmart.org/interest-group/2957/women-lead,women lead,2957,Montgomery County Democratic Womens Leadership,15973997
WI;https://justfacts.votesmart.org/interest-group/2957/women-lead,women lead,2957,Montgomery County Democratic Womens Leadership Initative,48337962
WI;https://justfacts.votesmart.org/interest-group/2957/women-lead,women lead,2957,Montgomery County Democratic Womens Leadership Initiative,28726345
WI;https://justfacts.votesmart.org/interest-group/2957/women-lead,women lead,2957,Montgomery County Democratic Womens Leadership Initiative Pac,5024968
WI;https://justfacts.votesmart.org/interest-group/2957/women-lead,women lead,2957,Montgomery County Republican Women Leadership,43114920
WI;https://justfacts.votesmart.org/interest-group/2957/women-lead,women lead,2957,Montgomery County Republican Womens Leadership,4665272
WI;https://justfacts.votesmart.org/interest-group/2957/women-lead,women lead,2957,Montgomery County Republicans Womens Leadership,45696287
WI;https://justfacts.votesmart.org/interest-group/2957/women-lead,women lead,2957,Montgomery County Womens Leadership,45988285
WI;https://justfacts.votesmart.org/interest-group/2674/aft-wisconsin-american-federation-of-teachers,aft wisconsin american federation of teachers,2674,TimeoutException,TimeoutException
WI;https://justfacts.votesmart.org/interest-group/2955/wisconsin-justice-initiative-action,wisconsin justice initiative action,2955,TimeoutException,TimeoutException
WI;https://justfacts.votesmart.org/interest-group/1993/service-employees-international-union-seiu-wisconsin,service employees international union seiu wisconsin,1993,TimeoutException,TimeoutException
WI;https://justfacts.votesmart.org/interest-group/2956/black-leaders-organizing-for-communities-bloc,black leaders organizing for communities bloc,2956,TimeoutException,TimeoutException
WI;https://justfacts.votesmart.org/interest-group/454/wisconsin-afl-cio,wisconsin afl cio,454,Wisconsin State Afl-Cio,20178
WI;https://justfacts.votesmart.org/interest-group/339/wisconsin-association-of-school-boards,wisconsin association of school boards,339,Wisconsin Association Of School Boards,24761670
WI;https://justfacts.votesmart.org/interest-group/2292/pro-life-wisconsin,pro life wisconsin,2292,Pro-Life Wisconsin,2928500
WI;https://justfacts.votesmart.org/interest-group/1159/wisconsin-farm-bureau,wisconsin farm bureau,1159,Wisconsin Farm Bureau,9525
WI;https://justfacts.votesmart.org/interest-group/638/planned-parenthood-advocates-of-wisconsin,planned parenthood advocates of wisconsin,638,TimeoutException,TimeoutException
WI;https://justfacts.votesmart.org/interest-group/1767/wisconsin-family-action,wisconsin family action,1767,Wisconsin Family Action,3175393
WI;https://justfacts.votesmart.org/interest-group/1767/wisconsin-family-action,wisconsin family action,1767,Wisconsin Family Action,54903109
WI;https://justfacts.votesmart.org/interest-group/1017/fair-wisconsin,fair wisconsin,1017,Fair Wisconsin,10239488
WI;https://justfacts.votesmart.org/interest-group/1017/fair-wisconsin,fair wisconsin,1017,Fair Wisconsin,10711990
WI;https://justfacts.votesmart.org/interest-group/1017/fair-wisconsin,fair wisconsin,1017,Fair Wisconsin,18929653
WI;https://justfacts.votesmart.org/interest-group/2570/madison-teachers-inc,madison teachers inc,2570,Madison Teachers Inc,10245553
WI;https://justfacts.votesmart.org/interest-group/2676/wisconsin-education-association-council,wisconsin education association council,2676,Wisconsin Education Association Council 10,40619709
WI;https://justfacts.votesmart.org/interest-group/2676/wisconsin-education-association-council,wisconsin education association council,2676,Wisconsin Education Association Council Political,44178300
WI;https://justfacts.votesmart.org/interest-group/2676/wisconsin-education-association-council,wisconsin education association council,2676,Wisconsin Education Association Council Region 1,37348783
WI;https://justfacts.votesmart.org/interest-group/2676/wisconsin-education-association-council,wisconsin education association council,2676,Wisconsin Education Association Council Region 3,39816217
WI;https://justfacts.votesmart.org/interest-group/2676/wisconsin-education-association-council,wisconsin education association council,2676,Wisconsin Education Association Council Region 5,29014787
WI;https://justfacts.votesmart.org/interest-group/2676/wisconsin-education-association-council,wisconsin education association council,2676,Wisconsin Education Association Council Region 6,20272
WI;https://justfacts.votesmart.org/interest-group/2676/wisconsin-education-association-council,wisconsin education association council,2676,Wisconsin Education Association Council Region 7,37348788
WI;https://justfacts.votesmart.org/interest-group/81/wisconsin-education-association-council,wisconsin education association council,81,Wisconsin Education Association Council 10,40619709
WI;https://justfacts.votesmart.org/interest-group/81/wisconsin-education-association-council,wisconsin education association council,81,Wisconsin Education Association Council Political,44178300
WI;https://justfacts.votesmart.org/interest-group/81/wisconsin-education-association-council,wisconsin education association council,81,Wisconsin Education Association Council Region 1,37348783
WI;https://justfacts.votesmart.org/interest-group/81/wisconsin-education-association-council,wisconsin education association council,81,Wisconsin Education Association Council Region 3,39816217
WI;https://justfacts.votesmart.org/interest-group/81/wisconsin-education-association-council,wisconsin education association council,81,Wisconsin Education Association Council Region 5,29014787
WI;https://justfacts.votesmart.org/interest-group/81/wisconsin-education-association-council,wisconsin education association council,81,Wisconsin Education Association Council Region 6,20272
WI;https://justfacts.votesmart.org/interest-group/81/wisconsin-education-association-council,wisconsin education association council,81,Wisconsin Education Association Council Region 7,37348788
WI;https://justfacts.votesmart.org/interest-group/352/wisconsin-gun-owners,wisconsin gun owners,352,Wisconsin Gun Owners,16614949
WI;https://justfacts.votesmart.org/interest-group/1253/wisconsin-medical-society,wisconsin medical society,1253,Wisconsin Medical Society,9532
WI;https://justfacts.votesmart.org/interest-group/1926/wisconsin-voters-for-companion-animals,wisconsin voters for companion animals,1926,TimeoutException,TimeoutException
WY;https://justfacts.votesmart.org/interest-group/2398/right-to-life-of-wyoming,right to life of wyoming,2398,Right To Life Of Wyoming,10188289
WY;https://justfacts.votesmart.org/interest-group/1229/wyoming-outdoor-council,wyoming outdoor council,1229,Wyoming Outdoor Council,27653074
WY;https://justfacts.votesmart.org/interest-group/2399/wyoming-family-coalition,wyoming family coalition,2399,Wyoming Family Coalition,10151955
WY;https://justfacts.votesmart.org/interest-group/174/prevent-child-abuse-wyoming,prevent child abuse wyoming,174,Prevent Child Abuse Wyoming,27653197
NA;https://justfacts.votesmart.org/interest-group/2963/inlandboatmens-union-of-the-pacific,inlandboatmens union of the pacific,2963,Inlandboatmens Union Of The Pacific,2598528
NA;https://justfacts.votesmart.org/interest-group/2963/inlandboatmens-union-of-the-pacific,inlandboatmens union of the pacific,2963,Inlandboatmens Union Of The Pacific,9591993
NA;https://justfacts.votesmart.org/interest-group/3084/interior-systems-local-352,interior systems local 352,3084,Interior Systems Local 352,46113409
WI;https://justfacts.votesmart.org/interest-group/688/the-wisconsin-prosperity-project,the wisconsin prosperity project,688,TimeoutException,TimeoutException
NA;https://justfacts.votesmart.org/interest-group/2361/independence-hall-tea-party-pac,independence hall tea party pac,2361,Independence Hall Tea Party Pac,16744700
WI;https://justfacts.votesmart.org/interest-group/1621/wisconsin-manufacturers-and-commerce,wisconsin manufacturers and commerce,1621,TimeoutException,TimeoutException
WI;https://justfacts.votesmart.org/interest-group/600/national-federation-of-independent-business-wisconsin,national federation of independent business wisconsin,600,TimeoutException,TimeoutException
NA;https://justfacts.votesmart.org/interest-group/2060/western-organization-of-resource-councils,western organization of resource councils,2060,Western Organization Of Resource Councils,10931214
NA;https://justfacts.votesmart.org/interest-group/2060/western-organization-of-resource-councils,western organization of resource councils,2060,Western Organization Of Resource Councils,27617867
NA;https://justfacts.votesmart.org/interest-group/2060/western-organization-of-resource-councils,western organization of resource councils,2060,Western Organization Of Resource Councils,39485889
NA;https://justfacts.votesmart.org/interest-group/3292/elect-educators-everywhere,elect educators everywhere,3292,Elect Educators Everywhere,51886225
WI;https://justfacts.votesmart.org/interest-group/2091/greater-green-bay-area-chamber-of-commerce,greater green bay area chamber of commerce,2091,TimeoutException,TimeoutException
NA;https://justfacts.votesmart.org/interest-group/109/defenders-of-wildlife-action-fund,defenders of wildlife action fund,109,Defenders Of Wildlife Action Fund 527 Account,44113955
NA;https://justfacts.votesmart.org/interest-group/2505/congressional-black-caucus-pac,congressional black caucus pac,2505,Congressional Black Caucus Pac Cbc,42481224
WY;https://justfacts.votesmart.org/interest-group/687/wyoming-prosperity-project,wyoming prosperity project,687,TimeoutException,TimeoutException
NA;https://justfacts.votesmart.org/interest-group/2532/aapi-victory-fund,aapi victory fund,2532,Aapi Victory Fund,40813066
NA;https://justfacts.votesmart.org/interest-group/2532/aapi-victory-fund,aapi victory fund,2532,Aapi Victory Fund,43842514
NA;https://justfacts.votesmart.org/interest-group/1925/independence-caucus,independence caucus,1925,Independence Caucus,200866
NA;https://justfacts.votesmart.org/interest-group/1702/american-wind-energy-association,american wind energy association,1702,American Wind Energy Association,9985
NA;https://justfacts.votesmart.org/interest-group/1695/international-warehouse-logistics-association,international warehouse logistics association,1695,International Warehouse Logistics Association,18927420
NA;https://justfacts.votesmart.org/interest-group/1695/international-warehouse-logistics-association,international warehouse logistics association,1695,International Warehouse Logistics Association,42876594
NA;https://justfacts.votesmart.org/interest-group/1695/international-warehouse-logistics-association,international warehouse logistics association,1695,International Warehouse Logistics Association,49404256
NA;https://justfacts.votesmart.org/interest-group/3127/moms-in-office,moms in office,3127,Moms In Office,49836453
NA;https://justfacts.votesmart.org/interest-group/1927/libertyslate,libertyslate,1927,TimeoutException,TimeoutException
NA;https://justfacts.votesmart.org/interest-group/2509/votevets,votevets,2509,Votevets,230352
NA;https://justfacts.votesmart.org/interest-group/2509/votevets,votevets,2509,Votevets,55496026
NA;https://justfacts.votesmart.org/interest-group/1467/christian-coalition-of-america,christian coalition of america,1467,Christian Coalition Of America,11250185
NA;https://justfacts.votesmart.org/interest-group/1467/christian-coalition-of-america,christian coalition of america,1467,Christian Coalition Of America,39503352
NA;https://justfacts.votesmart.org/interest-group/1467/christian-coalition-of-america,christian coalition of america,1467,Christian Coalition Of America,41698481
NA;https://justfacts.votesmart.org/interest-group/1467/christian-coalition-of-america,christian coalition of america,1467,Christian Coalition Of America,54916994
NA;https://justfacts.votesmart.org/interest-group/1909/veterans-and-military-families-for-progress,veterans and military families for progress,1909,TimeoutException,TimeoutException
NA;https://justfacts.votesmart.org/interest-group/1456/american-veterans,american veterans,1456,American Veterans,39503936
NA;https://justfacts.votesmart.org/interest-group/1456/american-veterans,american veterans,1456,American Veterans,44766079
NA;https://justfacts.votesmart.org/interest-group/1716/partnership-for-america,partnership for america,1716,Partnership For America,18928741
NA;https://justfacts.votesmart.org/interest-group/1716/partnership-for-america,partnership for america,1716,Partnership For America,27715478
NA;https://justfacts.votesmart.org/interest-group/1716/partnership-for-america,partnership for america,1716,Partnership For America,41691828
NA;https://justfacts.votesmart.org/interest-group/1751/church-world-service,church world service,1751,Church World Service,44627266
NA;https://justfacts.votesmart.org/interest-group/1751/church-world-service,church world service,1751,Church World Service,53846223
NA;https://justfacts.votesmart.org/interest-group/1751/church-world-service,church world service,1751,Church World Service,54822664
NA;https://justfacts.votesmart.org/interest-group/1713/st-joseph-health-system,st joseph health system,1713,St Joseph Health System,10655231
NA;https://justfacts.votesmart.org/interest-group/1713/st-joseph-health-system,st joseph health system,1713,St Joseph Health System,24576771
NA;https://justfacts.votesmart.org/interest-group/1713/st-joseph-health-system,st joseph health system,1713,St Joseph Health System,32041355
NA;https://justfacts.votesmart.org/interest-group/1713/st-joseph-health-system,st joseph health system,1713,St Joseph Health System,380339
NA;https://justfacts.votesmart.org/interest-group/671/the-woman-activist,the woman activist,671,TimeoutException,TimeoutException
NA;https://justfacts.votesmart.org/interest-group/2297/national-association-of-realtors,national association of realtors,2297,National Association Of Realtors,1823
NA;https://justfacts.votesmart.org/interest-group/2297/national-association-of-realtors,national association of realtors,2297,National Association Of Realtors,55400104
NA;https://justfacts.votesmart.org/interest-group/2221/j-street-pac,j street pac,2221,TimeoutException,TimeoutException
NA;https://justfacts.votesmart.org/interest-group/2863/national-cannabis-industry-association,national cannabis industry association,2863,National Cannabis Industry Association,24724785
NA;https://justfacts.votesmart.org/interest-group/2863/national-cannabis-industry-association,national cannabis industry association,2863,National Cannabis Industry Association,26793289
NA;https://justfacts.votesmart.org/interest-group/2863/national-cannabis-industry-association,national cannabis industry association,2863,National Cannabis Industry Association,47207976
NA;https://justfacts.votesmart.org/interest-group/1789/associated-equipment-distributors,associated equipment distributors,1789,Associated Equipment Distributors,2781623
NA;https://justfacts.votesmart.org/interest-group/1860/women-employed,women employed,1860,Women Employed,27698111
NA;https://justfacts.votesmart.org/interest-group/1860/women-employed,women employed,1860,Women Employed,3250088
NA;https://justfacts.votesmart.org/interest-group/1793/association-of-university-centers-on-disabilities,association of university centers on disabilities,1793,Association Of University Centers On Disabilities,39488654
NA;https://justfacts.votesmart.org/interest-group/2412/conservative-review,conservative review,2412,Texas Conservative Review,44813394
NA;https://justfacts.votesmart.org/interest-group/2559/national-association-of-home-builders,national association of home builders,2559,National Association Of Home Builders,1821
NA;https://justfacts.votesmart.org/interest-group/2485/moms-demand-action-for-gun-sense,moms demand action for gun sense,2485,Moms Demand Action For Gun Sense,27714101
NA;https://justfacts.votesmart.org/interest-group/138/national-association-of-government-contractors,national association of government contractors,138,TimeoutException,TimeoutException
NA;https://justfacts.votesmart.org/interest-group/1788/national-lumber-and-building-material-dealers-association,national lumber and building material dealers association,1788,TimeoutException,TimeoutException
NA;https://justfacts.votesmart.org/interest-group/1382/americans-for-immigration-control,americans for immigration control,1382,Americans For Immigration Control,5766
NA;https://justfacts.votesmart.org/interest-group/504/national-association-of-manufacturers,national association of manufacturers,504,National Association Of Manufacturers,2553378
NA;https://justfacts.votesmart.org/interest-group/2900/future-now-fund,future now fund,2900,Future Now Fund,44002605
NA;https://justfacts.votesmart.org/interest-group/978/americans-for-democratic-action-ada,americans for democratic action ada,978,Americans For Democratic Action-Ada,4890116
NA;https://justfacts.votesmart.org/interest-group/978/americans-for-democratic-action-ada,americans for democratic action ada,978,Americans For Democratic Action-Ada St Louis Chapter,4916036
NA;https://justfacts.votesmart.org/interest-group/978/americans-for-democratic-action-ada,americans for democratic action ada,978,Americans For Democratic Action-Pac (Ada),39125531
NA;https://justfacts.votesmart.org/interest-group/412/population-action-international,population action international,412,Population Action International,39486085
NA;https://justfacts.votesmart.org/interest-group/88/republican-liberty-caucus,republican liberty caucus,88,Republican Liberty Caucus,10244597
NA;https://justfacts.votesmart.org/interest-group/88/republican-liberty-caucus,republican liberty caucus,88,Republican Liberty Caucus,10704656
NA;https://justfacts.votesmart.org/interest-group/88/republican-liberty-caucus,republican liberty caucus,88,Republican Liberty Caucus,11055461
NA;https://justfacts.votesmart.org/interest-group/88/republican-liberty-caucus,republican liberty caucus,88,Republican Liberty Caucus,11270538
NA;https://justfacts.votesmart.org/interest-group/88/republican-liberty-caucus,republican liberty caucus,88,Republican Liberty Caucus,16755873
NA;https://justfacts.votesmart.org/interest-group/88/republican-liberty-caucus,republican liberty caucus,88,Republican Liberty Caucus,1817488
NA;https://justfacts.votesmart.org/interest-group/88/republican-liberty-caucus,republican liberty caucus,88,Republican Liberty Caucus,2002766
NA;https://justfacts.votesmart.org/interest-group/88/republican-liberty-caucus,republican liberty caucus,88,Republican Liberty Caucus,20363931
NA;https://justfacts.votesmart.org/interest-group/88/republican-liberty-caucus,republican liberty caucus,88,Republican Liberty Caucus,24865843
NA;https://justfacts.votesmart.org/interest-group/88/republican-liberty-caucus,republican liberty caucus,88,Republican Liberty Caucus,37064237
NA;https://justfacts.votesmart.org/interest-group/88/republican-liberty-caucus,republican liberty caucus,88,Republican Liberty Caucus,38431755
NA;https://justfacts.votesmart.org/interest-group/88/republican-liberty-caucus,republican liberty caucus,88,Republican Liberty Caucus,38606598
NA;https://justfacts.votesmart.org/interest-group/88/republican-liberty-caucus,republican liberty caucus,88,Republican Liberty Caucus,44645095
NA;https://justfacts.votesmart.org/interest-group/88/republican-liberty-caucus,republican liberty caucus,88,Republican Liberty Caucus,7593920
NA;https://justfacts.votesmart.org/interest-group/88/republican-liberty-caucus,republican liberty caucus,88,Republican Liberty Caucus,8874029
NA;https://justfacts.votesmart.org/interest-group/88/republican-liberty-caucus,republican liberty caucus,88,Republican Liberty Caucus,9954740
NA;https://justfacts.votesmart.org/interest-group/1862/americans-for-fair-taxation,americans for fair taxation,1862,Americans For Fair Taxation,1623608
NA;https://justfacts.votesmart.org/interest-group/1862/americans-for-fair-taxation,americans for fair taxation,1862,Americans For Fair Taxation,37938650
NA;https://justfacts.votesmart.org/interest-group/922/national-parks-conservation-association,national parks conservation association,922,National Parks Conservation Association,8005
NA;https://justfacts.votesmart.org/interest-group/846/people-for-the-american-way,people for the american way,846,People For The American Way,2014
NA;https://justfacts.votesmart.org/interest-group/2086/catholic-advocate,catholic advocate,2086,Catholic Advocate,29423934
NA;https://justfacts.votesmart.org/interest-group/2368/family-policy-alliance,family policy alliance,2368,Family Policy Alliance,41580670
NA;https://justfacts.votesmart.org/interest-group/2368/family-policy-alliance,family policy alliance,2368,Family Policy Alliance,47666354
NA;https://justfacts.votesmart.org/interest-group/2368/family-policy-alliance,family policy alliance,2368,Family Policy Alliance,47721197
NA;https://justfacts.votesmart.org/interest-group/2368/family-policy-alliance,family policy alliance,2368,Family Policy Alliance,47780517
NA;https://justfacts.votesmart.org/interest-group/2368/family-policy-alliance,family policy alliance,2368,Family Policy Alliance,49094509
NA;https://justfacts.votesmart.org/interest-group/2368/family-policy-alliance,family policy alliance,2368,Family Policy Alliance,53410803
NA;https://justfacts.votesmart.org/interest-group/2368/family-policy-alliance,family policy alliance,2368,Family Policy Alliance,54045659
NA;https://justfacts.votesmart.org/interest-group/2819/national-institute-for-reproductive-health-action-fund,national institute for reproductive health action fund,2819,National Institute For Reproductive Health Action Fund Inc,55441311
NA;https://justfacts.votesmart.org/interest-group/2819/national-institute-for-reproductive-health-action-fund,national institute for reproductive health action fund,2819,National Institute For Reproductive Health Action Fund Inc,55443058
NA;https://justfacts.votesmart.org/interest-group/2819/national-institute-for-reproductive-health-action-fund,national institute for reproductive health action fund,2819,National Institute For Reproductive Health Action Fund Inc,55444270
NA;https://justfacts.votesmart.org/interest-group/2819/national-institute-for-reproductive-health-action-fund,national institute for reproductive health action fund,2819,National Institute For Reproductive Health Action Fund Inc,55554529
NA;https://justfacts.votesmart.org/interest-group/149/service-employees-international-union-seiu,service employees international union seiu,149,Service Employees International Union Seiu,54955839
NA;https://justfacts.votesmart.org/interest-group/2647/value-in-electing-women-political-action-committee-view-pac,value in electing women political action committee view pac,2647,TimeoutException,TimeoutException
NA;https://justfacts.votesmart.org/interest-group/2451/the-evolution-institute,the evolution institute,2451,TimeoutException,TimeoutException
NA;https://justfacts.votesmart.org/interest-group/2496/capa21,capa21,2496,Capa21-Federal Qualified Multicandidate Committee,52492689
NA;https://justfacts.votesmart.org/interest-group/2496/capa21,capa21,2496,Capa21-Limited,49657215
NA;https://justfacts.votesmart.org/interest-group/1977/goproud,goproud,1977,"Goproud, Inc",39005514
NA;https://justfacts.votesmart.org/interest-group/1977/goproud,goproud,1977,Inc Goproud,44124727
